PNword	review
가볍고	무게 도 가볍고 , 지문 으로 로그인 하 는 시스템 도 좋 아요
가볍고	무게 도 엄청나 게 가볍고 다만 크 기가 크 어서 전용 가방 아니 ᄆ 잘 안 들어가 네요
가볍	제 가 쓰 는 맥 보다 훨씬 화면 은 크 ᆫ데 무게 는 훨씬 가볍 네요
가볍	무게 에 비하 아 정말 정말 가볍
가볍고	현재 15인치 노트북 을 사용 하 고 있 는데 17인치 그램 은 화면 은 크 고 , 무게 는 가볍고 정말 좋 네요
가볍	가볍 어서 들 고 다니 는데 도 1 중 지장 없 고 여자 ᆫ데 도 무게 에 부담 없 어서 좋 네요 용산 에 직접 가 아서 메모리 도 업그레이드 바로 받 고 직접 박스 도 보여주 시 고 하 아서 더 안심 이 되 더라 구용 키스킨 이랑 화면 에 붙이 는 보호대 모두 붙이 었 는데 것 의 기포 없이 잘 붙 었 어요 기본 적 인 사은품 이 많 아서 기타 악세사리 를 제 가 따로 안 사 도 되 니까 추가비용 이 전혀 없 어서 좋 네요 마우스 부터 노트북 케이스 키스킨 화면 보호 스킨 전부 이 다 주 시 고 최고 예 용
가볍	아내 생일 선물 로 사주 이 었 는데 디자인 , 무게 , 성능 삼박자 가 잘 맞 는 상품 이 ㅂ니다 팬 소음 도 심하 지 않 고 화면 도 크 고 무엇 보다 가볍 어서 휴대성 도 좋 네요 좋 은 상품 좋 은 가격 에 잘 사 았 습니다 감사합니다
약간	약간 의 발열 이 있 으나 크 ᆫ 화면 , 가볍 ᆫ 무게 만족 하 ㅂ니다 
가볍	약간 의 발열 이 있 으나 크 ᆫ 화면 , 가볍 ᆫ 무게 만족 하 ㅂ니다
적당	디자인 이야 뭐 다른 노트북 에 비하 아 훨씬 예쁘 ᆫ 것 같 고 크 다고 ㅎ ㅠ 대 못하 고 그렇 ᆯ 정도 는 아니 ᆫ 것 같 아요 근데 여자 분 들 이 쓰 시 기 에 는 15인치 가 적당 하 지 않 을까 싶 네요 그래도 크기 랑 무게 차이 가 좀 있 기 ᆫ 있 습니다
가볍	그 로부터 가볍 ᆫ 무게 와 LG 에서 만 느끼 ᆯ 수 있 는 IPS 의 액정 화질 에 놀라 아서 그램 광 팬 이 되 어 버리 었 네요
무겁	기존 노트북 은 오래되 ᆫ 것 이 라 무겁 어서 것 의 무기 수준 이 았 는데 그램 은 17인치 임 에 도 무게 가 넘 가볍 어요 
가볍	기존 노트북 은 오래되 ᆫ 것 이 라 무겁 어서 것 의 무기 수준 이 았 는데 그램 은 17인치 임 에 도 무게 가 넘 가볍 어요
가볍	무게 도 크기 에 비하 아 가볍 네요 노트북 케이스 도 마음 에 들 어요
가볍고	무게 도 가볍고 화면 크기 도 시원시원 하 고 아주 좋 아요 i7 이랑 i5 고민 많이 하 았 는데 둘 이 차이 가 미세 하 고 저 는 웹서핑 영화감상 인강 용 으로 만 사용 하 ᆯ거라 이 모델 로 하 았 습니다
가볍	무게 또한 너무 가볍 구요
가볍	무게 는 들 때 마다 가볍 어서 신기 하 고
적당	다른 노트북 보다 화면 이 크 어서 좋 아요 정말 광활 하 ᆫ 느낌 이 드 ㅂ니다 그래서 동영상 이나 사진 작업 에 정말 좋은 것 같 아요 다르 ᆫ 브랜드 노트북 들 15인치 가 그램 17 이랑 비슷 하 ᆫ 것 같 아요 배 젤 이 얇 게 나오 아서 화면 은 크 지만 외부 사이즈 는 가지 고 다니 기 적당 하 어요 그램 이 라는 이름 처럼 무게 도 얼마 안 나가 고 가볍 어요 색상 도 하얗 ᆫ 것 이 깔끔 하 게 예쁘 어서 마음 에 쏙 드 ㅂ니다 나중 에 램 을 추가 하 ᆯ 수 있 는 여유 슬롯 도 있 어서 좋 고 윈도우10 도 쉽 게 설치 하 았 어요 그리고 배송 도 엄청 빨리 오 았 어 요다 만 마우스 가 고장나 ᆫ 것 이 오 아서 문의 글 남기 고 추가 배송 받 은 것 이 약간 번거롭 었 어요 하 지만 칼 배송 하 아 주 시 어서 대만족 하 ㅂ니다 
가볍	다른 노트북 보다 화면 이 크 어서 좋 아요 정말 광활 하 ᆫ 느낌 이 드 ㅂ니다 그래서 동영상 이나 사진 작업 에 정말 좋은 것 같 아요 다르 ᆫ 브랜드 노트북 들 15인치 가 그램 17 이랑 비슷 하 ᆫ 것 같 아요 배 젤 이 얇 게 나오 아서 화면 은 크 지만 외부 사이즈 는 가지 고 다니 기 적당 하 어요 그램 이 라는 이름 처럼 무게 도 얼마 안 나가 고 가볍 어요 색상 도 하얗 ᆫ 것 이 깔끔 하 게 예쁘 어서 마음 에 쏙 드 ㅂ니다 나중 에 램 을 추가 하 ᆯ 수 있 는 여유 슬롯 도 있 어서 좋 고 윈도우10 도 쉽 게 설치 하 았 어요 그리고 배송 도 엄청 빨리 오 았 어 요다 만 마우스 가 고장나 ᆫ 것 이 오 아서 문의 글 남기 고 추가 배송 받 은 것 이 약간 번거롭 었 어요 하 지만 칼 배송 하 아 주 시 어서 대만족 하 ㅂ니다 
약간	다른 노트북 보다 화면 이 크 어서 좋 아요 정말 광활 하 ᆫ 느낌 이 드 ㅂ니다 그래서 동영상 이나 사진 작업 에 정말 좋은 것 같 아요 다르 ᆫ 브랜드 노트북 들 15인치 가 그램 17 이랑 비슷 하 ᆫ 것 같 아요 배 젤 이 얇 게 나오 아서 화면 은 크 지만 외부 사이즈 는 가지 고 다니 기 적당 하 어요 그램 이 라는 이름 처럼 무게 도 얼마 안 나가 고 가볍 어요 색상 도 하얗 ᆫ 것 이 깔끔 하 게 예쁘 어서 마음 에 쏙 드 ㅂ니다 나중 에 램 을 추가 하 ᆯ 수 있 는 여유 슬롯 도 있 어서 좋 고 윈도우10 도 쉽 게 설치 하 았 어요 그리고 배송 도 엄청 빨리 오 았 어 요다 만 마우스 가 고장나 ᆫ 것 이 오 아서 문의 글 남기 고 추가 배송 받 은 것 이 약간 번거롭 었 어요 하 지만 칼 배송 하 아 주 시 어서 대만족 하 ㅂ니다
가볍	무게 : 가볍 다
가볍	그런데 무게 는 오히려 일반 15인치 보다 더 가볍 죠
가볍고	집 컴퓨터 가 수명 을 다하 아 가 아서 새로 살 려고 알아보 던 차 에 마침 G마켓 에서 빅스마일데이 할인 으로 아주 저렴 하 게 잘 구매 하 았 습니다 컴퓨터 를 쓰 다가 노트북 으로 넘어가 는 것 이 라 화면 이 너무 작 아서 답답 하 면 어쩌 나 걱정 하 았 는데 받 아 보 니 17인치 이 라 전혀 안 답답 하 고 좋 습니다 LG 그램 시리즈 이 라 17인치 이 라는 크 ᆫ 화면 에 비하 아 무게 도 휴대 가 가능 하 ᆯ 정도 로 가볍고 무엇 보다 이쁘 어요
가볍	예전 부터 구매 하 고 싶 었 는데 망설이 다 실제로 구매 하 아서 받 아 보 니 대화면 17인치 WQXGA 초고 해상도 가볍 ᆫ 무게 얇 은 베젤 풀 배열 백라이트 키보드 썬더볼트
가볍	오래가 는 배터리 게다가 가볍 ᆫ 무게 까지
가볍고	그램 은 가격 때문 에 고민 을 많이 하 았었 는데 상당히 저렴 하 게 구입 하 았 습니다 우선 배송 이 엄청 빠르 고 포장 도 신경 쓰 어서 하 아 주 시 ᆫ게 보이 ㅂ니다 무게 는 두말 하 ᆯ 것 없이 가볍고 크기 도 크 어서 좋 습니다 같이 구입 하 ᆫ 윈도우 도 설치 하 아 잘 사용 하 ㅂ니다 적극 추천
가볍	평소 주변 지인 들 노트북 이 14인치 13인치 이 라서 17인치 는 얼마나 크 ᆯ지 감 이 잘 안 잡히 었 는데 그래도 그램 은 작 겠 지 하 고 막상 받 으니 엄청 크게 느껴지 네요 그러 어도 무게 는 가볍 ᆫ 편 에 속하 ㅂ니다
가볍	정말 그램 의 명성 답 게 17인치 임 에 도 너무 가볍 습니다 15인치 와 17인치 사이 에서 고민 하 았 는데 이 정도 무게 이 라면 17인치 선택 하 기 를 잘 하 ᆫ 것 같 습니다
가볍고	역시 나 기대 하 았 던 대로 무게 는 가볍고 화면 은 크 고 상당히 만족 하 ㅂ니다
가볍	차량 이동 시 찾아가 기 쉽 ᄆ ( 직접 수령 시 잊 지 않 고 사은품 제공 ) 제품 특징 매우 가볍 고 성능 빵빵 경쟁사 모델 은 15인치 가 그램 17인치 와 유사 무게 이 죠
가볍고	17인치 대비 무게 도 가볍고 좋 네요
약간	무게 가 아주 약간 무겁 다는 느낌 이 있 습니다 
무겁	무게 가 아주 약간 무겁 다는 느낌 이 있 습니다
가볍고	사은품 으로 주 시 ᆫ 가죽 파우치 도 이쁘 고 깔끔 하 네요 제 가 가지 고 있 는 맥북 프로 15인치 와 비교 하 면 크기 는 살짝 커지 었 지만 무게 는 더 가볍고 화면 은 정말 커지 었 습니다
가볍고	17인치 대비 무게 도 가볍고 좋 네요
가볍	기존 LG 15인치 사용 중 이 았 는데 17인치 무게 가 상상 이상 으로 더 가볍 네요 자주 가지 고 다니 어야 하 는 특성 상 탁월 하 ᆫ 선택 이 았 습니다 노트북 에 이런 크 ᆫ 화면 이 라니 업무처리 ？ 동영상 자주 보 는 저 로서 는 만족도 최상 이 ㅂ니다
가볍고	무게 도 정말 가볍고 화면 크기 에 비하 아 사이즈 도 작 아서 원래 가지 고 있 던 15인치 노트북 파우치 에 들어가 ᆯ 정도 이 어서 아주 만족스럽 습니다
무겁	이전 에 너무 무겁 ᆫ 노트북 을 들 고 다니 어서 너무 힘들 었 는데 무게 감도 좋 구 역시 나 밧데리 가 너무나 만족스럽 네요 혼자 서 윈도우 설치 하 는 것 도 어렵 지 않 아서 초짜 인 저 도 설치 하 고 지금 사용 중 이 ㅂ니다 감사합니다
가볍	작년 겨울 엘지전자 판매대 에서 그램 을 보 고 가볍 ᆫ 무게 와 심플 하 ᆫ 디자인 에 반하 아서 1 년 을 고민 하 았 습니다
가볍	두께 화면 넓이 그리고 들어보 면 환상적 인 무게 한 손 으로 들 어도 부담 없 는 이 가볍 ᄆ
가볍	무게 차이 는 15인치 랑 17인치 랑 좀 나 는 것 같 더라고요 그래도 제품 자체 가 너무 가볍 어서 17인치 도 손쉽 게 휴대 가능 하 ᆯ 것 같 아요
가볍	17인치 인 데 무게 가볍 구요 업무용 으로 x 1 carbon 쓰 는데 뭐 크 ᆫ 차이 느끼 어 지 지 않 네요 부피 는 차이 가 있 구요 15인치 가방 에 들어가 ㅂ니다 그리고 제일 중요 하 ᆫ 것 제 가 착각 을 하 았 는데 이 노트북 메모리 8 기가 온 보드 이 ㅂ니다 기존 8 기가 제거 하 고 16 기가 두개 로 듀얼 채널 하 려 하 았 는데 뻘 짓 하 았 네요 듀얼 채널 하 시 려면 8 기가 하나 구매 하 시 구요 아니 면 16 기가 메모리 추가 하 는 것 로 요 그리 고 ssd nvme 추가 하 시 는 분 들 속도 로 인 하 아서 기존 ssd 를 제거 하 고 그 자리 에 속도 높 은 것 장착 하 고 기존 꺼 ㄹ 옆 빈 곳 으로 하 아야 하 ㅂ니다 뒤 팔 ᆫ 따 아 보 니 이것 두 번 하 ᆯ 짓 은 못 되 ᄆ 다 돈 있 음 업체 맡기 는 것 로
가볍	휴대용 으로 갤럭시북 쓰 었 던 게 가볍 ᆫ 게 좋 아서 이 었 는데 그램 은 화면 이 두 배 가 넘 는데 무게 는 더 가볍 네요 
가볍	휴대용 으로 갤럭시북 쓰 었 던 게 가볍 ᆫ 게 좋 아서 이 었 는데 그램 은 화면 이 두 배 가 넘 는데 무게 는 더 가볍 네요
가볍고	무게 는 상당히 가볍고 화면 은 정말 넓 어서 너무 만족스럽 습니다
가볍	메모리 , SSD , 윈도우10 추가 하 았 더니 가격 이 많이 늘어나 았 지만 , 성능 이 뛰어나 고 무게 가 가볍 어서 매우 만족 하 ㅂ니다
가볍	화면 이 크 고 무게 가볍 다는 것 이 얼마나 좋은 것 인지 를 체험 하 ㅂ니다
가볍	디자인 이 슬림 하 아서 이 ᆫ지 17인치 이 지만 투박 하 지 않 고 예쁘 어요 무게 는 당연 그램 이 라 가볍 구요 옆 으로 길 ᆫ 감 이 있 지만 기존 쓰 던 15인치 와 차이 크게 차이 가 없 네요 제일 맘 에 들 는 것 이 ᆫ 확장슬롯 이 있 어서 좋 앙 아이 들 을 키우 다보니 사진 이 많 은데 기존 노트북 도 저장 을 많이 하 니 느리 어 지 는데 공간 을 늘리 ᆯ 수 있 으니 모으 았 다가 정리 하 ᆯ 수 있 어 좋은것 같 아요 구매 이 유중 제일 크 ᆫ 부분 이 에요 제품 도 쓰 어 보 니 빠르 어요 배송 은 꼼꼼 하 게 포장 을 잘 하 아 주 시 었 어요 뽁뽁이 를 많이 감 아 주 시 었 어 이 어 사은품 도 잘 오 았 어요 조금 아쉽 ᆫ 점 은 지방 이 라서 택배 로 받 았 는데 어찌 오 ᆯ까 걱정 되 었 는데 택배 박스 에 취급 주의 이 라는 말 도 없이 오 고 택배 텍 에 도 모델명 과 사은품 민 쓰 어 있 다보니 택배 기사 님 이 내용물 을 정확히 일 ᆫ지 못하 시 었 우 ㄹ 듯 싶 어요 그래서 집 앞 에 그냥 놓 고 가시 었 어요 다음 에 는 취급 주의 나 우체국 택배 이 면 좋 을 덧 같 아요 잘 쓰 ᆯ게요 디자인 이 슬림 하 아서 이 ᆫ지 17인치 이 지만 투박 하 지 않 고 예쁘 어요 무게 는 당연 그램 이 라 가볍 구요 옆 으로 길 ᆫ 감 이 있 지만 기존 쓰 던 15인치 와 차이 크게 차이 가 없 네요 제일 맘 에 들 는 것 이 ᆫ 확장슬롯 이 있 어서 좋 앙 아이 들 을 키우 다보니 사진 이 많 은데 기존 노트북 도 저장 을 많이 하 니 느리 어 지 는데 공간 을 늘리 ᆯ 수 있 으니 모으 았 다가 정리 하 ᆯ 수 있 어 좋은것 같 아요 구매 이 유중 제일 크 ᆫ 부분 이 에요 제품 도 쓰 어 보 니 빠르 어요 배송 은 꼼꼼 하 게 포장 을 잘 하 아 주 시 었 어요 뽁뽁이 를 많이 감 아 주 시 었 어 이 어 사은품 도 잘 오 았 어요 조금 아쉽 ᆫ 점 은 지방 이 라서 택배 로 받 았 는데 어찌 오 ᆯ까 걱정 되 었 는데 택배 박스 에 취급 주의 이 라는 말 도 없이 오 고 택배 텍 에 도 모델명 과 사은품 민 쓰 어 있 다보니 택배 기사 님 이 내용물 을 정확히 일 ᆫ지 못하 시 었 우 ㄹ 듯 싶 어요 그래서 집 앞 에 그냥 놓 고 가시 었 어요 다음 에 는 취급 주의 나 우체국 택배 이 면 좋 을 덧 같 아요 잘 쓰 ᆯ게요 디자인 이 슬림 하 아서 이 ᆫ지 17인치 이 지만 투박 하 지 않 고 예쁘 어요 무게 는 당연 그램 이 라 가볍 구요 옆 으로 길 ᆫ 감 이 있 지만 기존 쓰 던 15인치 와 차이 크게 차이 가 없 네요 제일 맘 에 들 는 것 이 ᆫ 확장슬롯 이 있 어서 좋 앙 아이 들 을 키우 다보니 사진 이 많 은데 기존 노트북 도 저장 을 많이 하 니 느리 어 지 는데 공간 을 늘리 ᆯ 수 있 으니 모으 았 다가 정리 하 ᆯ 수 있 어 좋은것 같 아요 구매 이 유중 제일 크 ᆫ 부분 이 에요 제품 도 쓰 어 보 니 빠르 어요 배송 은 꼼꼼 하 게 포장 을 잘 하 아 주 시 었 어요 뽁뽁이 를 많이 감 아 주 시 었 어 이 어 사은품 도 잘 오 았 어요 조금 아쉽 ᆫ 점 은 지방 이 라서 택배 로 받 았 는데 어찌 오 ᆯ까 걱정 되 었 는데 택배 박스 에 취급 주의 이 라는 말 도 없이 오 고 택배 텍 에 도 모델명 과 사은품 민 쓰 어 있 다보니 택배 기사 님 이 내용물 을 정확히 일 ᆫ지 못하 시 었 우 ㄹ 듯 싶 어요 그래서 집 앞 에 그냥 놓 고 가시 었 어요 다음 에 는 취급 주의 나 우체국 택배 이 면 좋 을 덧 같 아요 잘 쓰 ᆯ게요 디자인 이 슬림 하 아서 이 ᆫ지 17인치 이 지만 투박 하 지 않 고 예쁘 어요 무게 는 당연 그램 이 라 가볍 구요 옆 으로 길 ᆫ 감 이 있 지만 기존 쓰 던 15인치 와 차이 크게 차이 가 없 네요 제일 맘 에 들 는 것 이 ᆫ 확장슬롯 이 있 어서 좋 앙 아이 들 을 키우 다보니 사진 이 많 은데 기존 노트북 도 저장 을 많이 하 니 느리 어 지 는데 공간 을 늘리 ᆯ 수 있 으니 모으 았 다가 정리 하 ᆯ 수 있 어 좋은것 같 아요 구매 이 유중 제일 크 ᆫ 부분 이 에요 제품 도 쓰 어 보 니 빠르 어요 배송 은 꼼꼼 하 게 포장 을 잘 하 아 주 시 었 어요 뽁뽁이 를 많이 감 아 주 시 었 어 이 어 사은품 도 잘 오 았 어요 조금 아쉽 ᆫ 점 은 지방 이 라서 택배 로 받 았 는데 어찌 오 ᆯ까 걱정 되 었 는데 택배 박스 에 취급 주의 이 라는 말 도 없이 오 고 택배 텍 에 도 모델명 과 사은품 민 쓰 어 있 다보니 택배 기사 님 이 내용물 을 정확히 일 ᆫ지 못하 시 었 우 ㄹ 듯 싶 어요 그래서 집 앞 에 그냥 놓 고 가시 었 어요 다음 에 는 취급 주의 나 우체국 택배 이 면 좋 을 덧 같 아요 잘 쓰 ᆯ게요 
가볍	디자인 이 슬림 하 아서 이 ᆫ지 17인치 이 지만 투박 하 지 않 고 예쁘 어요 무게 는 당연 그램 이 라 가볍 구요 옆 으로 길 ᆫ 감 이 있 지만 기존 쓰 던 15인치 와 차이 크게 차이 가 없 네요 제일 맘 에 들 는 것 이 ᆫ 확장슬롯 이 있 어서 좋 앙 아이 들 을 키우 다보니 사진 이 많 은데 기존 노트북 도 저장 을 많이 하 니 느리 어 지 는데 공간 을 늘리 ᆯ 수 있 으니 모으 았 다가 정리 하 ᆯ 수 있 어 좋은것 같 아요 구매 이 유중 제일 크 ᆫ 부분 이 에요 제품 도 쓰 어 보 니 빠르 어요 배송 은 꼼꼼 하 게 포장 을 잘 하 아 주 시 었 어요 뽁뽁이 를 많이 감 아 주 시 었 어 이 어 사은품 도 잘 오 았 어요 조금 아쉽 ᆫ 점 은 지방 이 라서 택배 로 받 았 는데 어찌 오 ᆯ까 걱정 되 었 는데 택배 박스 에 취급 주의 이 라는 말 도 없이 오 고 택배 텍 에 도 모델명 과 사은품 민 쓰 어 있 다보니 택배 기사 님 이 내용물 을 정확히 일 ᆫ지 못하 시 었 우 ㄹ 듯 싶 어요 그래서 집 앞 에 그냥 놓 고 가시 었 어요 다음 에 는 취급 주의 나 우체국 택배 이 면 좋 을 덧 같 아요 잘 쓰 ᆯ게요 디자인 이 슬림 하 아서 이 ᆫ지 17인치 이 지만 투박 하 지 않 고 예쁘 어요 무게 는 당연 그램 이 라 가볍 구요 옆 으로 길 ᆫ 감 이 있 지만 기존 쓰 던 15인치 와 차이 크게 차이 가 없 네요 제일 맘 에 들 는 것 이 ᆫ 확장슬롯 이 있 어서 좋 앙 아이 들 을 키우 다보니 사진 이 많 은데 기존 노트북 도 저장 을 많이 하 니 느리 어 지 는데 공간 을 늘리 ᆯ 수 있 으니 모으 았 다가 정리 하 ᆯ 수 있 어 좋은것 같 아요 구매 이 유중 제일 크 ᆫ 부분 이 에요 제품 도 쓰 어 보 니 빠르 어요 배송 은 꼼꼼 하 게 포장 을 잘 하 아 주 시 었 어요 뽁뽁이 를 많이 감 아 주 시 었 어 이 어 사은품 도 잘 오 았 어요 조금 아쉽 ᆫ 점 은 지방 이 라서 택배 로 받 았 는데 어찌 오 ᆯ까 걱정 되 었 는데 택배 박스 에 취급 주의 이 라는 말 도 없이 오 고 택배 텍 에 도 모델명 과 사은품 민 쓰 어 있 다보니 택배 기사 님 이 내용물 을 정확히 일 ᆫ지 못하 시 었 우 ㄹ 듯 싶 어요 그래서 집 앞 에 그냥 놓 고 가시 었 어요 다음 에 는 취급 주의 나 우체국 택배 이 면 좋 을 덧 같 아요 잘 쓰 ᆯ게요 디자인 이 슬림 하 아서 이 ᆫ지 17인치 이 지만 투박 하 지 않 고 예쁘 어요 무게 는 당연 그램 이 라 가볍 구요 옆 으로 길 ᆫ 감 이 있 지만 기존 쓰 던 15인치 와 차이 크게 차이 가 없 네요 제일 맘 에 들 는 것 이 ᆫ 확장슬롯 이 있 어서 좋 앙 아이 들 을 키우 다보니 사진 이 많 은데 기존 노트북 도 저장 을 많이 하 니 느리 어 지 는데 공간 을 늘리 ᆯ 수 있 으니 모으 았 다가 정리 하 ᆯ 수 있 어 좋은것 같 아요 구매 이 유중 제일 크 ᆫ 부분 이 에요 제품 도 쓰 어 보 니 빠르 어요 배송 은 꼼꼼 하 게 포장 을 잘 하 아 주 시 었 어요 뽁뽁이 를 많이 감 아 주 시 었 어 이 어 사은품 도 잘 오 았 어요 조금 아쉽 ᆫ 점 은 지방 이 라서 택배 로 받 았 는데 어찌 오 ᆯ까 걱정 되 었 는데 택배 박스 에 취급 주의 이 라는 말 도 없이 오 고 택배 텍 에 도 모델명 과 사은품 민 쓰 어 있 다보니 택배 기사 님 이 내용물 을 정확히 일 ᆫ지 못하 시 었 우 ㄹ 듯 싶 어요 그래서 집 앞 에 그냥 놓 고 가시 었 어요 다음 에 는 취급 주의 나 우체국 택배 이 면 좋 을 덧 같 아요 잘 쓰 ᆯ게요 디자인 이 슬림 하 아서 이 ᆫ지 17인치 이 지만 투박 하 지 않 고 예쁘 어요 무게 는 당연 그램 이 라 가볍 구요 옆 으로 길 ᆫ 감 이 있 지만 기존 쓰 던 15인치 와 차이 크게 차이 가 없 네요 제일 맘 에 들 는 것 이 ᆫ 확장슬롯 이 있 어서 좋 앙 아이 들 을 키우 다보니 사진 이 많 은데 기존 노트북 도 저장 을 많이 하 니 느리 어 지 는데 공간 을 늘리 ᆯ 수 있 으니 모으 았 다가 정리 하 ᆯ 수 있 어 좋은것 같 아요 구매 이 유중 제일 크 ᆫ 부분 이 에요 제품 도 쓰 어 보 니 빠르 어요 배송 은 꼼꼼 하 게 포장 을 잘 하 아 주 시 었 어요 뽁뽁이 를 많이 감 아 주 시 었 어 이 어 사은품 도 잘 오 았 어요 조금 아쉽 ᆫ 점 은 지방 이 라서 택배 로 받 았 는데 어찌 오 ᆯ까 걱정 되 었 는데 택배 박스 에 취급 주의 이 라는 말 도 없이 오 고 택배 텍 에 도 모델명 과 사은품 민 쓰 어 있 다보니 택배 기사 님 이 내용물 을 정확히 일 ᆫ지 못하 시 었 우 ㄹ 듯 싶 어요 그래서 집 앞 에 그냥 놓 고 가시 었 어요 다음 에 는 취급 주의 나 우체국 택배 이 면 좋 을 덧 같 아요 잘 쓰 ᆯ게요 
