PNword	review
좋	간단 하 ᆫ 삼 ㅜ 업무 를 진행 하 는데 발열 과 소음 문제 는 전혀 없 는 것 같 네요 가성비 로 유명 하 ᆫ 제품 이 듯 정말 가성비 가 좋 습니다 사은품 도 많이 주 어서 아주 만족스럽 습니다
추천	가성비 노트북 으로 추천 드리 어요
최고	키보드 위치 와 감각 등 새롭 ᆫ 환경 에 익숙 하 어 지 는데다 소 시간 이 걸리 겠 지만 잠시 사용 하 아 보 ᆫ 경험 으로 는 가성비 최고 이 ㅂ니다
고려	그램 을 고민 하 기 도 하 았 지만 어차피 데스크탑 대용 이 므로 울트라 를 선택 하 았 는데 가성비 를 고려 하 았 을 때 좋 은 선택 이 었 던 것 같 습니다 
좋	그램 을 고민 하 기 도 하 았 지만 어차피 데스크탑 대용 이 므로 울트라 를 선택 하 았 는데 가성비 를 고려 하 았 을 때 좋 은 선택 이 었 던 것 같 습니다
대비	모니터 보호필름 은 똥 손 이 라 붙이 다 실패 구매 금액 대비 가성비 좋 습니다 
좋	모니터 보호필름 은 똥 손 이 라 붙이 다 실패 구매 금액 대비 가성비 좋 습니다
좋	처음 에 LG GRAM 으로 알아보 다가 가성비 가 좋 은 상품 이 없 나 찾 다가 걸리 ᆫ 제품 이 네요
대비	배송 두 생각 하 았 던 것 보다 빨리 오 고 가격 대비 가성비 좋 습니다 
좋	배송 두 생각 하 았 던 것 보다 빨리 오 고 가격 대비 가성비 좋 습니다
최고	블로그 에 가성비 최고 이 라는 평 이 많 더라고요
대비	그램 이랑 울트라북 둘 중 에 엄청 고민 하 았 으나 결국 에 울트라북 으로 구매 하 았 네요 무게 는 그램 보다 많이 무겁 기 ᆫ 하지만 가격 대비 가성비 좋 고 세일 기간 내 에 30 마 넌 가량 할인 되 ᆫ 금액 으로 구매 하 게 되 어서 좋 네요 전 에 쓰 던 노트북 이 오래 되 어서 새로 살 ᆫ 노트북 은 빠르 고 좋 네요 윈도우 도 깔 아 지 어서 있 어 좋 아요 
좋	그램 이랑 울트라북 둘 중 에 엄청 고민 하 았 으나 결국 에 울트라북 으로 구매 하 았 네요 무게 는 그램 보다 많이 무겁 기 ᆫ 하지만 가격 대비 가성비 좋 고 세일 기간 내 에 30 마 넌 가량 할인 되 ᆫ 금액 으로 구매 하 게 되 어서 좋 네요 전 에 쓰 던 노트북 이 오래 되 어서 새로 살 ᆫ 노트북 은 빠르 고 좋 네요 윈도우 도 깔 아 지 어서 있 어 좋 아요 
좋	그램 이랑 울트라북 둘 중 에 엄청 고민 하 았 으나 결국 에 울트라북 으로 구매 하 았 네요 무게 는 그램 보다 많이 무겁 기 ᆫ 하지만 가격 대비 가성비 좋 고 세일 기간 내 에 30 마 넌 가량 할인 되 ᆫ 금액 으로 구매 하 게 되 어서 좋 네요 전 에 쓰 던 노트북 이 오래 되 어서 새로 살 ᆫ 노트북 은 빠르 고 좋 네요 윈도우 도 깔 아 지 어서 있 어 좋 아요 
좋	그램 이랑 울트라북 둘 중 에 엄청 고민 하 았 으나 결국 에 울트라북 으로 구매 하 았 네요 무게 는 그램 보다 많이 무겁 기 ᆫ 하지만 가격 대비 가성비 좋 고 세일 기간 내 에 30 마 넌 가량 할인 되 ᆫ 금액 으로 구매 하 게 되 어서 좋 네요 전 에 쓰 던 노트북 이 오래 되 어서 새로 살 ᆫ 노트북 은 빠르 고 좋 네요 윈도우 도 깔 아 지 어서 있 어 좋 아요 
좋	그램 이랑 울트라북 둘 중 에 엄청 고민 하 았 으나 결국 에 울트라북 으로 구매 하 았 네요 무게 는 그램 보다 많이 무겁 기 ᆫ 하지만 가격 대비 가성비 좋 고 세일 기간 내 에 30 마 넌 가량 할인 되 ᆫ 금액 으로 구매 하 게 되 어서 좋 네요 전 에 쓰 던 노트북 이 오래 되 어서 새로 살 ᆫ 노트북 은 빠르 고 좋 네요 윈도우 도 깔 아 지 어서 있 어 좋 아요
최고	빅스마일데이 쿠폰 으로 로 착하 ᆫ 가격 에 최고 의 가성비 노트북 을 가지 게 되 었 네요
괜찮	집 에서 사용 , 15인치 이상 , 램 8 G , 윈도우10 포함 되 ᆫ 노트북 으로 알아보 던 중 브랜드 노트북 중 에 는 가장 가성비 가 괜찮 다고 생각 하 아서 구매 하 았 습니다 : ) 집 에서 웹서핑 / 문서작성 등 기본 적 인 사용 에 충분 하 구 색상 도 예쁘 어서 어머니 가 특히 좋아하 시 네요
최고	기존 에 사용 하 던 노트북 을 교체 하 ᆯ 시 기가 되 었 는데 때마침 G마켓 에서 행사 를 통하 아서 저렴 하 게 구매 를 하 게 되 었 네요 컴알못 이 라 검색 을 통하 아서 정보 를 얻 었 는데 가성비 최고 이 라는 의견 들 이 많 아서 구매 를 확실 지 었 습니다 배송 도 빠르 고 제품 도 하자 없 고 구성품 도 빠짐없이 잘 도착 하 았 네요 잘 쓰 겠 습니다
만족	회사 에서 쓰 던 노트북 이 문제 가 조금씩 생기 어서 매일 스트레스 를 받 아 교체 를 생각 하 아 이곳저곳 검색 하 다가 가성비 짱 인 LG 그램 을 선택 하 았 는데 이것저것 사은품 도 같이 오 고 특별히 따로 필요 하 ᆫ 것 없이 사용 하 ᆯ 수 있 고 무엇 보다 업무 상 사용 하 ᆯ 때 빠르 ᆫ 실행 에 문제 가 없 어 너무 만족 하 ㅂ니다
좋	가성비 좋 아요 추천 하 ㅂ니다 
추천	가성비 좋 아요 추천 하 ㅂ니다
좋	가성비 좋 아요 추천 하 ㅂ니다 
추천	가성비 좋 아요 추천 하 ㅂ니다
좋	대기업 제품 인 데 가성비 가 좋 다고 생각 되 어 마음 에 드 ㅂ니다
훌륭	디자인 부터 화면 화질 , 처리속도 , 주변기기 호 완성 등 가성비 가 훌륭 하 ㅂ니다
좋	무게 는 그램 보다 조금 더 나가 지만 가성비 가 좋 네요
탁월	그램 시리즈 보 다는 더 안정성 있 고 가성비 가 탁월 하 어 두루두루 만족 하 ᆯ 만 하 다 ㅎ ㅠ 대 이 거나 이동 하 면서 사용 하 ᆯ게 아니 어서 울트라 PC 를 선택 하 았 는데 아주 잘 하 ᆫ 것 같 다 디자인 도 색상 도 예쁘 어서 애초 에 쥐색 을 원하 았 던 남편 도 만족 하 아 하 ᆫ다 
만족	그램 시리즈 보 다는 더 안정성 있 고 가성비 가 탁월 하 어 두루두루 만족 하 ᆯ 만 하 다 ㅎ ㅠ 대 이 거나 이동 하 면서 사용 하 ᆯ게 아니 어서 울트라 PC 를 선택 하 았 는데 아주 잘 하 ᆫ 것 같 다 디자인 도 색상 도 예쁘 어서 애초 에 쥐색 을 원하 았 던 남편 도 만족 하 아 하 ᆫ다 
만족	그램 시리즈 보 다는 더 안정성 있 고 가성비 가 탁월 하 어 두루두루 만족 하 ᆯ 만 하 다 ㅎ ㅠ 대 이 거나 이동 하 면서 사용 하 ᆯ게 아니 어서 울트라 PC 를 선택 하 았 는데 아주 잘 하 ᆫ 것 같 다 디자인 도 색상 도 예쁘 어서 애초 에 쥐색 을 원하 았 던 남편 도 만족 하 아 하 ᆫ다
고려	패드 , 키스킨 , 필름 은 없 었 는데 ㅠㅠ 아깝 당 가성비 가심 비 를 고려 하 아 적극 강추 강추
좋	가성비 도 좋 고 마음 에 드 ㅂ니다
만족	안 에 구성품 도 잘 들 어 있 고 , 배송 도 빠르 아서 만족 하 ㅂ니다 : D 성능 좋 은 컴퓨터 가성비 좋 게 사 아서 전체 적 으로 만족 스럽 어요 
좋	안 에 구성품 도 잘 들 어 있 고 , 배송 도 빠르 아서 만족 하 ㅂ니다 : D 성능 좋 은 컴퓨터 가성비 좋 게 사 아서 전체 적 으로 만족 스럽 어요 
좋	안 에 구성품 도 잘 들 어 있 고 , 배송 도 빠르 아서 만족 하 ㅂ니다 : D 성능 좋 은 컴퓨터 가성비 좋 게 사 아서 전체 적 으로 만족 스럽 어요 
만족	안 에 구성품 도 잘 들 어 있 고 , 배송 도 빠르 아서 만족 하 ㅂ니다 : D 성능 좋 은 컴퓨터 가성비 좋 게 사 아서 전체 적 으로 만족 스럽 어요
최고	가성비 가 최고
최고	가성비 정말 최고 이 ㅂ니다
좋	가성비 좋 아요 노트북 은 엘지
좋	가성비 좋 구요
